{
  "$schema": "http://json-schema.org/draft-07/schema#",
  "$comment": "Generated by scripts/fixture-schema.mjs from app/src/lib/schema-vocab.ts. Do not edit.",
  "title": "Barkpark Studio schema type",
  "type": "object",
  "required": [
    "name",
    "fields"
  ],
  "additionalProperties": false,
  "properties": {
    "name": {
      "description": "The type's name.",
      "type": "string"
    },
    "title": {
      "description": "Its label.",
      "type": "string"
    },
    "fields": {
      "description": "Its fields.",
      "type": "array",
      "items": {
        "$ref": "#/definitions/field"
      }
    },
    "listPreview": {
      "description": "A list row: {title, subtitle, media} field names."
    },
    "list_preview": {
      "description": "listPreview, as Barkpark spells it."
    },
    "groups": {
      "description": "Field groups (tabs): [{name, title, default?}]."
    },
    "fieldsets": {
      "description": "Sanity's fieldsets for the document's own fields, as a composite's."
    },
    "initialValues": {
      "description": "A new document's starting values."
    },
    "initial_values": {
      "description": "initialValues, as Barkpark spells it."
    },
    "desk": {
      "description": "Desk settings: orderings, views; hidden: true keeps the type off Barkpark's desk while its URLs still open (barkpark#22789).",
      "type": "object",
      "properties": {
        "hidden": {
          "type": "boolean",
          "description": "Off the desk; the type still opens from a direct URL."
        }
      }
    },
    "singleton": {
      "description": "One document, whose id is the type's name.",
      "type": "boolean"
    },
    "layout": {
      "description": "The Expectation for PortableDoc types (decision 0004)."
    },
    "prefill": {
      "description": "A new PortableDoc document's starting blocks."
    },
    "visibility": {
      "description": "\"public\" or \"private\": who may read its documents.",
      "enum": [
        "public",
        "private"
      ]
    },
    "actions": {
      "description": "Barkpark document actions the type declares."
    },
    "icon": {
      "description": "Its icon."
    },
    "kind": {
      "description": "\"document\" or \"object\" (a named type other schemas use as a field type).",
      "enum": [
        "document",
        "object"
      ]
    },
    "owner_scoped": {
      "description": "Documents scoped to their owner."
    },
    "desk_groups": {
      "description": "Desk groups."
    },
    "cross_validations": {
      "description": "Cross-field rules: [{name, title, rule, level, fields}]."
    },
    "cors_origins": {
      "description": "Origins allowed to read it from a browser."
    },
    "readerWrites": {
      "description": "What a read seat may write on this type (barkpark#22790): {create, patchFields}; studioComment uses it so Viewers comment (J49)."
    }
  },
  "definitions": {
    "rule": {
      "type": "object",
      "additionalProperties": false,
      "properties": {
        "required": {
          "description": "The field must have a value.",
          "type": "boolean"
        },
        "min": {
          "description": "At least this many characters, items, or this number.",
          "type": "number"
        },
        "max": {
          "description": "At most this many characters, items, or this number.",
          "type": "number"
        },
        "pattern": {
          "description": "A regular expression the text (or a slug's current) must match; Barkpark enforces it on write.",
          "type": "string",
          "format": "regex"
        },
        "unique": {
          "description": "arrayOf: no two items with the same reference or value.",
          "type": "boolean"
        },
        "level": {
          "description": "\"error\" (blocks publishing, the default), \"warning\" or \"info\".",
          "enum": [
            "error",
            "warning",
            "warn",
            "info"
          ]
        },
        "message": {
          "description": "What to say instead of the default text.",
          "type": "string"
        }
      }
    },
    "field": {
      "type": "object",
      "required": [
        "name",
        "type"
      ],
      "additionalProperties": false,
      "properties": {
        "name": {
          "description": "The field's name (its path segment).",
          "type": "string"
        },
        "title": {
          "description": "Its label.",
          "type": "string"
        },
        "description": {
          "description": "Help text under the label."
        },
        "type": {
          "description": "One of the field types.",
          "enum": [
            "string",
            "text",
            "number",
            "integer",
            "float",
            "boolean",
            "date",
            "datetime",
            "time",
            "url",
            "email",
            "slug",
            "select",
            "tags",
            "color",
            "reference",
            "image",
            "file",
            "arrayOf",
            "composite",
            "geopoint",
            "codelist",
            "localizedText",
            "richText",
            "markdown",
            "json",
            "source"
          ]
        },
        "refType": {
          "description": "reference: the type it points to.",
          "type": "string"
        },
        "to": {
          "description": "reference: the types it may point to, [{type}]."
        },
        "rows": {
          "description": "text: the textarea's height.",
          "type": "number"
        },
        "of": {
          "description": "arrayOf: the member field.",
          "$ref": "#/definitions/member"
        },
        "fields": {
          "description": "composite, image: the subfields.",
          "type": "array",
          "items": {
            "$ref": "#/definitions/field"
          }
        },
        "options": {
          "description": "Type-specific: select's choices (a list, or {list, direction} as Sanity's), slug's source, image's hotspot, file's accept, reference's filter, …"
        },
        "layout": {
          "description": "arrayOf: \"grid\" or \"list\"."
        },
        "group": {
          "description": "The field group (tab) it shows in.",
          "type": "string"
        },
        "validation": {
          "description": "A rule, or a list of rules.",
          "anyOf": [
            {
              "$ref": "#/definitions/rule"
            },
            {
              "type": "array",
              "items": {
                "$ref": "#/definitions/rule"
              }
            }
          ]
        },
        "initialValue": {
          "description": "An array member's starting values."
        },
        "languages": {
          "description": "localizedText: the languages it holds."
        },
        "fallbackChain": {
          "description": "localizedText: the order readers fall back through."
        },
        "editor": {
          "description": "richText: \"blocks\" for Barkpark's block editor."
        },
        "codelistId": {
          "description": "codelist: \"<plugin>:<name>\"."
        },
        "preview": {
          "description": "An array item's row: {title, subtitle} subfield names."
        },
        "visibleWhen": {
          "description": "Shown only when {field, operator, value, scope?} holds."
        },
        "readOnly": {
          "description": "true, or a condition like visibleWhen."
        },
        "fieldsets": {
          "description": "composite: Sanity's fieldsets, [{name, title, options: {collapsible, collapsed, columns}}]."
        },
        "fieldset": {
          "description": "The fieldset (of its composite) it shows in."
        },
        "weak": {
          "description": "reference: Sanity's weak reference; kept, not enforced by Barkpark."
        },
        "ordered": {
          "description": "arrayOf: adds reordering.",
          "type": "boolean"
        },
        "blocks": {
          "description": "richText: the block vocabulary for Barkpark's editor (styles, lists, marks, annotations, of, inline: inline objects [{name, fields}])."
        },
        "format": {
          "description": "localizedText: \"plain\" or \"rich\"."
        },
        "refTypeTolerant": {
          "description": "reference: resolve the target as any type.",
          "type": "boolean"
        },
        "refTypes": {
          "description": "reference: the types it may point to (another spelling of `to`)."
        },
        "surface": {
          "description": "\"body\" or \"sidebar\" (metadata only)."
        },
        "encrypted": {
          "description": "Encrypted at rest."
        },
        "private": {
          "description": "Per-field read visibility."
        },
        "visibility": {
          "description": "Per-field read visibility."
        },
        "readable_by": {
          "description": "Per-field read visibility."
        },
        "onix": {
          "description": "Passed through for ONIX export."
        },
        "source": {
          "description": "slug: the field it derives from (also options.source)."
        },
        "hotspot": {
          "description": "image: the focal point (also options.hotspot)."
        },
        "alt": {
          "description": "image: true shows an alt input."
        },
        "version": {
          "description": "codelist: the pinned version."
        }
      }
    },
    "member": {
      "type": "object",
      "required": [
        "type"
      ],
      "additionalProperties": false,
      "properties": {
        "name": {
          "description": "The field's name (its path segment).",
          "type": "string"
        },
        "title": {
          "description": "Its label.",
          "type": "string"
        },
        "description": {
          "description": "Help text under the label."
        },
        "type": {
          "description": "One of the field types.",
          "enum": [
            "string",
            "text",
            "number",
            "integer",
            "float",
            "boolean",
            "date",
            "datetime",
            "time",
            "url",
            "email",
            "slug",
            "select",
            "tags",
            "color",
            "reference",
            "image",
            "file",
            "arrayOf",
            "composite",
            "geopoint",
            "codelist",
            "localizedText",
            "richText",
            "markdown",
            "json",
            "source"
          ]
        },
        "refType": {
          "description": "reference: the type it points to.",
          "type": "string"
        },
        "to": {
          "description": "reference: the types it may point to, [{type}]."
        },
        "rows": {
          "description": "text: the textarea's height.",
          "type": "number"
        },
        "of": {
          "description": "arrayOf: the member field.",
          "$ref": "#/definitions/member"
        },
        "fields": {
          "description": "composite, image: the subfields.",
          "type": "array",
          "items": {
            "$ref": "#/definitions/field"
          }
        },
        "options": {
          "description": "Type-specific: select's choices (a list, or {list, direction} as Sanity's), slug's source, image's hotspot, file's accept, reference's filter, …"
        },
        "layout": {
          "description": "arrayOf: \"grid\" or \"list\"."
        },
        "group": {
          "description": "The field group (tab) it shows in.",
          "type": "string"
        },
        "validation": {
          "description": "A rule, or a list of rules.",
          "anyOf": [
            {
              "$ref": "#/definitions/rule"
            },
            {
              "type": "array",
              "items": {
                "$ref": "#/definitions/rule"
              }
            }
          ]
        },
        "initialValue": {
          "description": "An array member's starting values."
        },
        "languages": {
          "description": "localizedText: the languages it holds."
        },
        "fallbackChain": {
          "description": "localizedText: the order readers fall back through."
        },
        "editor": {
          "description": "richText: \"blocks\" for Barkpark's block editor."
        },
        "codelistId": {
          "description": "codelist: \"<plugin>:<name>\"."
        },
        "preview": {
          "description": "An array item's row: {title, subtitle} subfield names."
        },
        "visibleWhen": {
          "description": "Shown only when {field, operator, value, scope?} holds."
        },
        "readOnly": {
          "description": "true, or a condition like visibleWhen."
        },
        "fieldsets": {
          "description": "composite: Sanity's fieldsets, [{name, title, options: {collapsible, collapsed, columns}}]."
        },
        "fieldset": {
          "description": "The fieldset (of its composite) it shows in."
        },
        "weak": {
          "description": "reference: Sanity's weak reference; kept, not enforced by Barkpark."
        },
        "ordered": {
          "description": "arrayOf: adds reordering.",
          "type": "boolean"
        },
        "blocks": {
          "description": "richText: the block vocabulary for Barkpark's editor (styles, lists, marks, annotations, of, inline: inline objects [{name, fields}])."
        },
        "format": {
          "description": "localizedText: \"plain\" or \"rich\"."
        },
        "refTypeTolerant": {
          "description": "reference: resolve the target as any type.",
          "type": "boolean"
        },
        "refTypes": {
          "description": "reference: the types it may point to (another spelling of `to`)."
        },
        "surface": {
          "description": "\"body\" or \"sidebar\" (metadata only)."
        },
        "encrypted": {
          "description": "Encrypted at rest."
        },
        "private": {
          "description": "Per-field read visibility."
        },
        "visibility": {
          "description": "Per-field read visibility."
        },
        "readable_by": {
          "description": "Per-field read visibility."
        },
        "onix": {
          "description": "Passed through for ONIX export."
        },
        "source": {
          "description": "slug: the field it derives from (also options.source)."
        },
        "hotspot": {
          "description": "image: the focal point (also options.hotspot)."
        },
        "alt": {
          "description": "image: true shows an alt input."
        },
        "version": {
          "description": "codelist: the pinned version."
        }
      }
    }
  }
}
