{
  "name": "author",
  "title": "Author",
  "visibility": "public",
  "list_preview": {"title": "name", "media": "image"},
  "desk": {"views": [{"id": "posts", "title": "Posts", "type": "post", "by": "content.author", "orderings": [{"field": "title", "direction": "asc"}]}]},
  "fields": [
    {"name": "name", "title": "Name", "type": "string", "validation": {"required": true}},
    {"name": "slug", "title": "Slug", "type": "slug", "options": {"source": "name"}},
    {"name": "image", "title": "Image", "type": "image", "options": {"hotspot": true}},
    {"name": "bio", "title": "Bio", "type": "text", "rows": 4},
    {"name": "expertise", "title": "Expertise", "type": "reference", "refType": "category"}
  ]
}
