{
  "name": "fieldTypes",
  "title": "Field types",
  "visibility": "public",
  "fieldsets": [
    {
      "name": "size",
      "title": "Size",
      "options": {
        "columns": 2
      }
    },
    {
      "name": "more",
      "title": "More",
      "options": {
        "collapsible": true,
        "collapsed": true
      }
    }
  ],
  "initial_values": {
    "count": 3,
    "hiddenNote": "Read the terms"
  },
  "fields": [
    {
      "name": "title",
      "title": "Title",
      "type": "string",
      "validation": {
        "required": true
      }
    },
    {
      "name": "choice",
      "title": "Choice",
      "type": "select",
      "options": [
        {
          "value": "a",
          "title": "Alpha"
        },
        {
          "value": "b",
          "title": "Beta"
        },
        {
          "value": "c",
          "title": "Gamma"
        }
      ]
    },
    {
      "name": "agree",
      "title": "Agree",
      "type": "boolean",
      "options": {
        "layout": "checkbox"
      }
    },
    {
      "name": "day",
      "title": "Day",
      "type": "date",
      "options": {
        "dateFormat": "DD.MM.YYYY"
      }
    },
    {
      "name": "at",
      "title": "At",
      "type": "datetime",
      "options": {
        "dateFormat": "DD.MM.YYYY",
        "timeFormat": "HH:mm",
        "timeStep": 15
      }
    },
    {
      "name": "handle",
      "title": "Handle",
      "type": "slug",
      "options": {
        "source": "title",
        "maxLength": 20
      },
      "validation": {
        "required": true
      }
    },
    {
      "name": "place",
      "title": "Place",
      "type": "geopoint"
    },
    {
      "name": "weakRef",
      "title": "Weak reference",
      "type": "reference",
      "refType": "post",
      "weak": true,
      "options": {
        "disableNew": true
      }
    },
    {
      "name": "colours",
      "title": "Colours",
      "type": "arrayOf",
      "ordered": true,
      "of": {
        "type": "string"
      },
      "options": {
        "list": [
          {
            "value": "red",
            "title": "Red"
          },
          {
            "value": "green",
            "title": "Green"
          },
          {
            "value": "blue",
            "title": "Blue"
          }
        ],
        "layout": "grid"
      }
    },
    {
      "name": "cards",
      "title": "Cards",
      "type": "arrayOf",
      "ordered": true,
      "layout": "grid",
      "of": {
        "type": "composite",
        "name": "card",
        "fields": [
          {
            "name": "label",
            "title": "Label",
            "type": "string"
          },
          {
            "name": "note",
            "title": "Note",
            "type": "text",
            "rows": 2
          }
        ]
      }
    },
    {
      "name": "sections",
      "title": "Sections",
      "type": "arrayOf",
      "ordered": true,
      "of": {
        "type": "composite",
        "name": "section",
        "preview": {
          "title": "title"
        },
        "fields": [
          {
            "name": "title",
            "title": "Title",
            "type": "string"
          },
          {
            "name": "items",
            "title": "Items",
            "type": "arrayOf",
            "ordered": true,
            "of": {
              "type": "composite",
              "name": "item",
              "preview": {
                "title": "label"
              },
              "fields": [
                {
                  "name": "label",
                  "title": "Label",
                  "type": "string"
                },
                {
                  "name": "note",
                  "title": "Note",
                  "type": "text",
                  "rows": 2
                }
              ]
            }
          }
        ]
      }
    },
    {
      "name": "blocks",
      "title": "Blocks",
      "type": "arrayOf",
      "ordered": true,
      "of": {
        "type": "composite",
        "name": "block",
        "preview": {
          "title": "heading"
        },
        "options": {
          "typeField": "kind",
          "fieldsByType": {
            "hero": [
              "heading"
            ],
            "quote": [
              "heading"
            ],
            "cta": [
              "heading"
            ],
            "stat": [
              "heading"
            ],
            "faq": [
              "heading"
            ],
            "logo": [
              "heading"
            ]
          }
        },
        "fields": [
          {
            "name": "kind",
            "title": "Kind",
            "type": "select",
            "options": [
              {
                "value": "hero",
                "title": "Hero"
              },
              {
                "value": "quote",
                "title": "Quote"
              },
              {
                "value": "cta",
                "title": "Call to action"
              },
              {
                "value": "stat",
                "title": "Stat"
              },
              {
                "value": "faq",
                "title": "FAQ"
              },
              {
                "value": "logo",
                "title": "Logo strip"
              }
            ]
          },
          {
            "name": "heading",
            "title": "Heading",
            "type": "string"
          }
        ]
      }
    },
    {
      "name": "address",
      "title": "Address",
      "type": "composite",
      "fieldsets": [
        {
          "name": "where",
          "title": "Where",
          "options": {
            "collapsible": true,
            "collapsed": false,
            "columns": 2
          }
        }
      ],
      "fields": [
        {
          "name": "street",
          "title": "Street",
          "type": "string",
          "fieldset": "where"
        },
        {
          "name": "city",
          "title": "City",
          "type": "string",
          "fieldset": "where"
        },
        {
          "name": "zip",
          "title": "Zip",
          "type": "string"
        }
      ]
    },
    {
      "name": "width",
      "title": "Width",
      "type": "number",
      "fieldset": "size"
    },
    {
      "name": "height",
      "title": "Height",
      "type": "number",
      "fieldset": "size"
    },
    {
      "name": "count",
      "title": "Count",
      "type": "integer",
      "validation": {
        "min": 0,
        "max": 10
      }
    },
    {
      "name": "hiddenNote",
      "title": "Shown when agreed",
      "type": "string",
      "visibleWhen": {
        "field": "agree",
        "operator": "eq",
        "value": true
      }
    },
    {
      "name": "lockedNote",
      "title": "Locked when agreed",
      "type": "string",
      "readOnly": {
        "field": "agree",
        "operator": "eq",
        "value": true
      }
    },
    {
      "name": "limit",
      "title": "Limit",
      "type": "number",
      "fieldset": "more",
      "validation": {
        "max": 10
      }
    },
    {
      "name": "attachment",
      "title": "Attachment",
      "type": "file",
      "options": {
        "accept": "image/*"
      }
    },
    {
      "name": "photo",
      "title": "Photo",
      "type": "image",
      "options": {
        "hotspot": true,
        "metadata": [
          "palette",
          "exif"
        ]
      }
    }
  ]
}
